1, 1, distinctio quos voluptas reiciendis et, Illum earum nobis voluptatum nesciunt nesciunt quia in. Optio tenetur distinctio deserunt iste non vel dolorum. Qui et voluptatem deserunt ullam dolor minus doloribus dignissimos. Ipsum rerum et expedita sit ut. Vel dicta quia quae et harum numquam., 2020-05-18 23:57:00, 2020-05-18 23:57:00
2, 14, blanditiis sunt occaecati voluptatibus et, Ducimus quod incidunt sed. Qui et officia enim in sit optio sapiente. Non quia expedita non ullam. Maiores minima qui culpa. Esse nam aut laudantium nostrum., 2020-05-18 23:35:07, 2020-05-18 23:35:07
3, 4, qui qui et ab ullam, Ducimus molestiae aperiam voluptas voluptas corporis. Optio facilis tenetur dolor tenetur quos non. Voluptas vel quidem quidem asperiores quod nesciunt est aut. Officiis dolor deserunt sit et molestias ut autem culpa. Adipisci laborum doloremque sint optio., 2020-05-19 02:13:17, 2020-05-19 02:13:17
4, 14, dolores eius velit recusandae necessitatibus, Et ullam quis quas nesciunt error vel hic provident. Est iste aut quia. Perferendis excepturi et ex earum. Voluptatem voluptas qui omnis itaque. Dolorem velit sunt neque necessitatibus., 2020-05-19 00:11:44, 2020-05-19 00:11:44
5, 13, neque voluptatem quos deserunt alias, Deleniti odit molestiae culpa dolores. Quia est aut ut dolor maiores. Labore at dolor similique nostrum. Veniam velit quibusdam enim accusamus recusandae beatae qui corporis. Ducimus et dolor ipsa totam delectus dolor., 2020-05-18 23:24:23, 2020-05-18 23:24:23
6, 6, ut id qui est minima, Aperiam ipsa praesentium at recusandae aut atque magnam aliquid. Minima iste rerum provident aliquam quaerat. Rerum asperiores aperiam exercitationem non numquam omnis. Dicta sapiente ea consequatur debitis. Tempore vitae neque placeat quod voluptates mollitia., 2020-05-19 01:58:03, 2020-05-19 01:58:03
7, 1, at et quam dolorum consequatur, Quia velit mollitia nulla quisquam illum. Non esse molestias tempora molestias. Sapiente commodi quod sapiente pariatur ut a nesciunt. Ad corporis quibusdam similique error veritatis eveniet. Porro consequatur asperiores nihil sint ut optio a., 2020-05-19 00:56:32, 2020-05-19 00:56:32
8, 18, accusantium et voluptas tenetur pariatur, Cum omnis officiis veniam neque nobis accusamus. Consequatur id ut deserunt qui occaecati natus. Similique delectus quasi quod sunt ex ab nostrum. In odit qui minima tempora. Est impedit id consequatur., 2020-05-18 22:25:52, 2020-05-18 22:25:52
9, 12, ex repellat quidem quibusdam soluta, Possimus asperiores minus dicta. Id repudiandae laborum rerum voluptatem in soluta accusantium. Consequatur sequi exercitationem eos dolorum. Placeat hic eius id eligendi. Quo et esse ex asperiores tempore., 2020-05-18 23:36:07, 2020-05-18 23:36:07
10, 3, pariatur odit atque inventore eos, Asperiores et et omnis. Tenetur impedit minus aut modi vero ipsum. Voluptatem impedit reiciendis ratione. Sint deleniti aut cumque aliquam aperiam porro magni. Et et minima sed voluptatem., 2020-05-19 02:45:09, 2020-05-19 02:45:09
11, 17, enim quasi vitae aut dicta, Et quod omnis nihil aperiam fuga. Qui possimus voluptatem voluptatibus optio. Suscipit maiores velit vel maxime quo. Rerum autem dolorum cupiditate quia. Rerum veritatis natus odit dolores quos iusto adipisci nobis., 2020-05-19 00:42:04, 2020-05-19 00:42:04
12, 15, quo quibusdam molestiae id quos, Voluptatem voluptates ipsa magni provident quaerat praesentium illo. Deserunt sed dolor et iste voluptas. Distinctio sint ut dolores dolor ut numquam officiis. Qui alias molestias rerum dolor error. Quae qui voluptas et ipsum., 2020-05-18 22:06:42, 2020-05-18 22:06:42
13, 1, quae beatae aliquid molestiae atque, Architecto eius sint quidem. Dicta voluptates unde et nostrum at. Nobis perferendis voluptates sed ad sequi architecto voluptas voluptatem. Voluptatem perferendis autem totam est omnis enim ea officiis. Sequi omnis doloribus quasi est iure delectus vero., 2020-05-19 01:32:40, 2020-05-19 01:32:40
14, 11, officia eaque rerum ea repellendus, Eveniet ut nihil laborum quia ipsam. Et accusantium sint expedita. Qui debitis nobis ut quaerat assumenda itaque veniam vel. Iste quod esse assumenda. Rem deserunt tenetur ut consequuntur quo cumque accusamus qui., 2020-05-19 01:51:46, 2020-05-19 01:51:46
15, 7, quaerat optio eum placeat odio, Laborum eos et nostrum voluptate nesciunt dolorem mollitia consectetur. Cum quia ut iure odit ut. Sed temporibus non in quam et sapiente. Ratione fugit architecto rerum magnam in. Et vero nemo cum ducimus et similique inventore., 2020-05-18 22:02:54, 2020-05-18 22:02:54
16, 3, et dolorum iste sapiente est, Aut ratione ad tenetur dolores. Cumque quidem eos similique eaque exercitationem ipsam soluta. Sint expedita quibusdam id sed. Optio quas non repudiandae harum natus sed vero exercitationem. Ut numquam sunt nam et., 2020-05-18 23:43:29, 2020-05-18 23:43:29
17, 12, dolores et officia accusamus aut, Neque at ut qui enim voluptas aut modi. Itaque ad suscipit exercitationem ea quos. In quibusdam accusamus natus eaque dolorem ab. Facere esse eius repellendus in eos reprehenderit aut. Beatae non sapiente magni vitae repellendus amet eaque sapiente., 2020-05-18 22:39:33, 2020-05-18 22:39:33
18, 18, magni modi et quam velit, Sit incidunt ut nemo laborum cupiditate sint. Velit distinctio voluptatum nostrum. Qui assumenda non aut architecto dignissimos velit. Sapiente voluptas eveniet rerum adipisci sint maiores sapiente et. Sunt voluptatum et qui et voluptate molestiae eos laudantium., 2020-05-18 23:35:18, 2020-05-18 23:35:18
19, 16, aut quis nihil occaecati quos, Atque sit ducimus quod occaecati iure architecto. Autem voluptas deserunt ad ut laborum. Necessitatibus qui fugit in. Dolores iusto aut error praesentium voluptate. Ut veniam sed vero., 2020-05-18 21:23:48, 2020-05-18 21:23:48
20, 7, iure asperiores quae minus consequatur, Voluptas cum dicta vel nulla adipisci est. Dolorum tempora cumque pariatur aut odit necessitatibus. A sed ab rerum qui commodi sit laboriosam. Tempore impedit veritatis sit odio sit. Quia blanditiis aspernatur ratione aperiam., 2020-05-18 23:49:13, 2020-05-18 23:49:13
21, 8, tempora vel aut et officia, Vel aperiam ut quo rerum dolor atque molestias. Ipsa ut facere ut assumenda vero. Perferendis labore non est odio id dolores voluptas. Porro consectetur doloremque vel. Ut aliquam laudantium et sed omnis natus voluptatem., 2020-05-18 22:24:47, 2020-05-18 22:24:47
22, 12, dolorum et quis ut dolorem, Voluptas iste nemo alias commodi iste. Quo consequatur rem ratione. Et impedit eligendi aut. Reprehenderit totam consectetur repellendus autem eveniet rerum quasi qui. Voluptas consequatur omnis voluptates temporibus voluptatem ex., 2020-05-19 02:32:41, 2020-05-19 02:32:41
23, 5, corporis hic praesentium laboriosam ducimus, Unde reprehenderit corrupti totam voluptas. Officia vel voluptatem architecto. Blanditiis velit veniam aut similique dicta iure culpa. Similique saepe aut qui est expedita sapiente. Et vitae veniam sed reiciendis quibusdam aut., 2020-05-18 23:47:45, 2020-05-18 23:47:45
24, 18, officia voluptatum hic qui in, Sed saepe esse odit. Sit assumenda sint consequuntur deserunt ut tempore repellat dolor. Architecto tempore et pariatur unde laboriosam architecto. Dolores consequatur quia fugit. Exercitationem deleniti numquam dolorum expedita., 2020-05-19 00:33:13, 2020-05-19 00:33:13
25, 4, rerum doloremque et asperiores non, Molestias quaerat nobis id autem delectus incidunt. Vel eos ea eum. Repellendus voluptatum et dolorum quidem quis ipsum itaque ab. Praesentium provident ut saepe nihil facilis. Odio esse consequatur ut rem., 2020-05-18 22:26:46, 2020-05-18 22:26:46
26, 15, nisi ut ut a ullam, Exercitationem est molestiae est cumque praesentium accusamus id. Doloribus non voluptatem dolor modi ut. Omnis eius illo iusto non provident dolor. Laborum et iure laboriosam. Inventore occaecati dolor non., 2020-05-18 22:11:39, 2020-05-18 22:11:39
27, 6, earum ipsam explicabo possimus voluptatem, Distinctio neque alias in dolor. Perferendis a perferendis ipsa vero nulla consequatur dolores dolores. Perferendis placeat unde ut dolor aut. Exercitationem enim dolor harum magnam quasi molestiae. Occaecati et possimus iusto suscipit animi est ratione qui., 2020-05-18 22:49:44, 2020-05-18 22:49:44
28, 15, soluta similique consequatur ut sit, Harum perferendis qui aut delectus qui quibusdam perspiciatis. Incidunt sed non facilis. Reiciendis doloremque enim ad nihil ad ipsam. Optio porro asperiores sed. Id impedit optio quae veniam provident et sint., 2020-05-18 22:44:19, 2020-05-18 22:44:19
29, 6, natus consequatur nemo atque et, Rerum aut laudantium et quia suscipit fugit. Ut et sint itaque possimus quos odit esse et. Vel fugit est ipsum aperiam ea aut. Hic eum corrupti accusantium omnis. Amet ipsa rem tenetur facilis., 2020-05-18 22:35:38, 2020-05-18 22:35:38
30, 2, veritatis dolorum et quos et, Pariatur quia dolore esse aut. Ut voluptatem quia expedita asperiores officiis voluptas. Magnam voluptates maiores amet laborum corrupti et occaecati. Consequatur dignissimos similique dolor et esse quos reprehenderit. Nesciunt voluptas ut nostrum., 2020-05-19 02:23:00, 2020-05-19 02:23:00
31, 3, deserunt qui provident eos in, Quos aut cum eveniet quisquam est fuga velit ut. Voluptates et ab blanditiis. Alias perspiciatis dolorem dolores. Velit doloribus et amet hic. Hic excepturi itaque quis enim et expedita maiores voluptas., 2020-05-18 21:38:06, 2020-05-18 21:38:06
32, 10, qui omnis at quis est, Voluptates reiciendis enim repellat. Molestias iste similique corrupti non possimus. Praesentium qui ullam ea. Voluptas illum dolores cum. Sint architecto iste perferendis commodi laborum., 2020-05-18 23:00:37, 2020-05-18 23:00:37
33, 11, non sed veritatis harum aut, Doloribus aspernatur rerum amet sint provident et suscipit. Ipsa molestiae nostrum fugit tempora nihil id. Sed quibusdam aliquid error aut repellat. Temporibus ex tempore sit neque. Et amet aliquid minus., 2020-05-18 22:59:31, 2020-05-18 22:59:31
34, 13, temporibus tempore dignissimos illo quos, Excepturi odit aut sapiente et commodi. Est et dolores repudiandae est. Cum sit ad beatae debitis excepturi est est. Voluptas aut est aperiam dolores. Porro officiis error hic similique voluptatem esse et voluptatem., 2020-05-18 23:27:06, 2020-05-18 23:27:06
35, 10, voluptas quo quisquam vel adipisci, Maxime vitae animi est iste eius dolorem quis dolor. Nulla ea officia voluptatem labore eos deleniti. Voluptatem odio occaecati eaque hic consequatur voluptatem. Nisi quaerat laborum sit hic nam inventore. Numquam porro magnam eius dolores., 2020-05-19 00:57:35, 2020-05-19 00:57:35
36, 3, ad vel eveniet impedit repellat, Hic debitis exercitationem suscipit delectus debitis ducimus ut. Architecto repudiandae dignissimos vitae quia impedit quisquam rerum qui. Eum nisi rem et optio et repellat. Eveniet minus quaerat rerum ut enim quibusdam dolor. Qui nam et soluta et., 2020-05-19 01:03:39, 2020-05-19 01:03:39
37, 11, vel laudantium sunt dolorem commodi, Quidem voluptatem libero dolorum commodi. Id tempora amet qui animi. Quidem et fugit ut ea recusandae neque itaque. Quisquam repellendus inventore qui qui rerum nobis. Nisi tempora voluptatem aut et ea praesentium., 2020-05-18 21:25:21, 2020-05-18 21:25:21
38, 2, dolores deserunt autem architecto quo, Eos quia ex aut aut. Ipsam est nobis soluta. Omnis ea alias qui temporibus aliquam. Totam accusantium voluptatem repellendus modi natus nulla consectetur sapiente. Animi dolor itaque ut., 2020-05-19 02:31:35, 2020-05-19 02:31:35
39, 8, delectus commodi nostrum laboriosam sint, Quia in consequatur possimus voluptas aperiam deleniti. Odit modi delectus occaecati. Iste quasi occaecati qui eum quae aperiam illum. Totam maiores magnam aliquid sunt. Quae accusantium ea aspernatur inventore libero nam impedit., 2020-05-18 21:54:27, 2020-05-18 21:54:27
40, 12, aut commodi libero maiores deleniti, Repellat atque et asperiores sed. Occaecati quod dolores rem qui beatae. Eaque ipsam aut laudantium earum eveniet non aut sint. Alias nihil nemo veniam est at voluptatem rerum. Et illum est eaque commodi molestiae nisi sed et., 2020-05-19 02:14:20, 2020-05-19 02:14:20
41, 1, modi accusamus illum nesciunt optio, Sed autem molestias numquam qui dolores odio. Dolor minima mollitia temporibus. Eligendi cupiditate odit et rerum quos blanditiis delectus ab. Fugiat ut sint quia provident. Numquam velit ad amet., 2020-05-19 02:14:47, 2020-05-19 02:14:47
42, 16, deleniti et dignissimos voluptatum aliquid, Est ex eos voluptatem deserunt quae quam. Reiciendis recusandae consequuntur asperiores enim ducimus quia temporibus. Accusantium eius occaecati reprehenderit aut. Sequi nesciunt aut autem. Minima id facilis itaque similique dicta sit repellat., 2020-05-19 00:09:59, 2020-05-19 00:09:59
43, 7, rerum velit id est est, Dolor sunt et vitae occaecati. Quia alias mollitia sed iure. Beatae id maxime voluptas eaque voluptas error consequatur dolorem. Sed molestiae nesciunt vel vitae beatae sit. Et autem laudantium porro eos magnam., 2020-05-19 00:19:44, 2020-05-19 00:19:44
44, 18, provident debitis facilis eligendi unde, Officia et et voluptate praesentium doloremque modi culpa in. Cum quis omnis fugit mollitia voluptatum et velit blanditiis. Qui quibusdam saepe et distinctio sint. Non ea laborum nesciunt sint. Mollitia minima ut quibusdam ut., 2020-05-18 23:50:08, 2020-05-18 23:50:08
45, 10, vel odio mollitia mollitia necessitatibus, Possimus est consequatur vitae alias incidunt est totam explicabo. Corrupti fugit dolores non. Commodi tempore ipsum sed veniam. Ea quos culpa facilis. Vitae voluptas vitae blanditiis beatae perferendis quos quam., 2020-05-19 01:01:07, 2020-05-19 01:01:07
46, 17, autem perferendis aspernatur laborum voluptas, Est aut mollitia velit nisi asperiores voluptatem quod corporis. Non non ea nulla est omnis mollitia saepe. Dolorem omnis dolore sed ut ab. Ea et repudiandae odit maiores officia. Odio odit ut ullam et., 2020-05-18 23:11:31, 2020-05-18 23:11:31
47, 4, dolores corrupti in aut quis, Laboriosam perferendis et possimus quia. Est sit nemo ea et sapiente odio consequatur. Voluptas autem nemo debitis tempore facere et. Suscipit voluptates dicta velit. In totam aut harum fugiat., 2020-05-18 22:00:43, 2020-05-18 22:00:43
48, 10, nulla nihil qui expedita odio, Magnam consequatur est eveniet ut quo laboriosam amet et. Saepe qui occaecati id maxime animi dolores voluptas quam. Tenetur omnis veniam quis perspiciatis saepe non quo. Voluptas ut magni veniam sunt. Consequatur expedita in unde., 2020-05-18 23:35:22, 2020-05-18 23:35:22
49, 16, totam laboriosam deleniti adipisci tempore, Ut tenetur quos est. Debitis eum occaecati nihil et eos quisquam distinctio molestias. Et et nihil quia. Velit possimus atque voluptates cum perferendis voluptatum ut dolorum. Eius a asperiores voluptas autem ex., 2020-05-18 22:53:31, 2020-05-18 22:53:31
50, 7, qui voluptatem et est consequuntur, Perferendis est eum dolor ex vero quae. Dolor nobis impedit ratione nam provident debitis cumque. Ut doloremque doloribus perferendis recusandae. Facilis est voluptatem ut inventore debitis nam. Blanditiis qui et inventore rerum sint., 2020-05-19 02:03:09, 2020-05-19 02:03:09
